{"alignment_sha256":"bbbbbbbbbbbbbbbbbbbbbbbbbbbbbbbbbbbbbbbbbbbbbbbbbbbbbbbbbbbbbbbb","checks":[{"columns":["payout_id"],"dataset":"payouts","id":"payout-id","kind":"identity","nulls":"forbid"},{"child_columns":["payout_id"],"child_dataset":"payments","id":"payment-payout","kind":"reference","nulls":"forbid","parent_identity":"payout-id"},{"child_dataset":"payments","child_group_columns":["payout_id"],"child_measure":"amount","comparison":"exact","id":"payout-total","kind":"conservation","nulls":"forbid","operator":"sum","parent_dataset":"payouts","parent_group_columns":["payout_id"],"parent_identity":"payout-id","parent_measure":"amount","tolerance":null}],"datasets":[{"columns":[{"name":"payout_id","type":"string"},{"name":"amount","type":"decimal"}],"id":"payments","policy_sha256":"cccccccccccccccccccccccccccccccccccccccccccccccccccccccccccccccc"},{"columns":[{"name":"payout_id","type":"string"},{"name":"amount","type":"decimal"}],"id":"payouts","policy_sha256":"dddddddddddddddddddddddddddddddddddddddddddddddddddddddddddddddd"}],"reconciliation_version":1}
